{
  "schemaVersion": 2,
  "id": "login",
  "module": "auth",
  "title": "账号登录",
  "prototype": {
    "entry": "prototype/index.html",
    "revision": 3,
    "alignedToSpec": "v1.2",
    "status": "aligned",
    "lastAlignedAt": "2026-09-15T10:17:30.763Z",
    "note": "Dual development document views verified in Chrome"
  },
  "dependencies": {
    "pages": [],
    "contracts": []
  }
}
