{
  "schemaVersion": 2,
  "id": "approvals",
  "module": "operations",
  "title": "审批管理",
  "prototype": {
    "entry": "prototype/index.html",
    "revision": 4,
    "alignedToSpec": "v1.1",
    "status": "aligned",
    "lastAlignedAt": "2026-09-15T08:05:50.231Z",
    "note": "运营界面模板已验证"
  },
  "dependencies": {
    "pages": [],
    "contracts": []
  }
}
